{
  "schema": "shiftory.benchmark-agent-quality-agent-run/v2",
  "case_id": "binary-asset-replacement",
  "candidate_id": "captured_config_b",
  "provider": "google (via GitHub Copilot CLI sub-agent)",
  "model": {
    "name": "gemini-3.7-flash",
    "version": "unknown"
  },
  "agent_tool_version": "copilot-cli-1.0.80",
  "evaluation_protocol": "Fresh, stateless GitHub Copilot CLI sub-agent (task tool, agent_type=general-purpose) given only this materialized prompt package directory and instructed to run shiftory explain --graphora off against the fixture repository, follow SKILL.md, and write its final verified explanation verbatim to RAW_RESPONSE.",
  "invocation": {
    "kind": "copilot_task",
    "agent_type": "general-purpose",
    "configured_model": "gemini-3.7-flash",
    "tool": "copilot-cli",
    "tool_version": "1.0.80",
    "task_id": null,
    "generation_started_at_utc": null,
    "generation_finished_at_utc": null,
    "generation_timing_unavailable_reason": "Migrated from an agent-run-v1 record. v1's started_at_utc/finished_at_utc were only ever the microsecond-apart bookkeeping time of reading an already-completed RAW_RESPONSE file, never the real generation time, which occurred in a separate Copilot CLI task sub-agent conversation this harness did not observe or control. Recorded honestly as unknown rather than propagating the misleading v1 values."
  },
  "capture_ingested_at_utc": "2026-09-02T02:28:29.518318+00:00",
  "prompt_package_manifest": [
    {
      "path": "INSTRUCTIONS.md",
      "sha256": "fcaedece84911bea6217bea59923cf5a85f0861897d3f74d4c998e8317908fa9"
    },
    {
      "path": "SKILL.md",
      "sha256": "0f7ddbe349e93b68924c2665f06e015114130083841702ce14c8c650b99c5be0"
    },
    {
      "path": "case.json",
      "sha256": "02b07a40e52b1e65f97331f6b493909e87503113eb3b21183c096ea6b23c81f3"
    },
    {
      "path": "repository/icon.dat",
      "sha256": "bc2ae48e004de7c6243ae5a7e03d3be9bab48cfe0d1da0e9af1b580b7b3f3748"
    }
  ],
  "prompt_package_digest": "24e885ea889c12cf78c1d5c761e78fe33378eef46e08931f201ad503c35ccad2",
  "evidence_sha256": "12b65f73af72a7bd15fb63336685ea8720e4021e20805067ff171eba3d95ee25",
  "engine_identity": {
    "component": "shiftory",
    "verification_method": "git_commit",
    "value": "f4e1a03630bb650be1c6477837a733a4f9f6420e"
  },
  "benchmark_protocol_commit": {
    "commit": "7b9d99ba6ecfae6dc53620362e87e776655ecb3b",
    "verification_method": "prompt_manifest_hash_match",
    "verified": true,
    "note": "Verified: commit 7b9d99ba6ecfae6dc53620362e87e776655ecb3b's full committed prompt protocol (case.json, SKILL.md, INSTRUCTIONS.md text, and the reconstructed fixture repository) reconstructs a manifest byte-identical to this capture's own recorded prompt_package_manifest -- proving this capture was generated against the exact protocol this commit defines, independent of any wall-clock ordering between the commit's timestamp and this capture's timestamps. This is the earliest commit at which both this case's content and the capture harness (agent_harness.py) are simultaneously present in history."
  },
  "generator_access_profile": {
    "repository_access": true,
    "filesystem_scope": "Runs in the same Copilot CLI environment as the orchestrating session; has general bash/file-system tool access and was instructed, but not sandboxed, to stay within the prompt package directory.",
    "network_access": false,
    "tool_access": [
      "bash",
      "view",
      "edit",
      "grep",
      "glob"
    ]
  },
  "isolation_method": "protocol",
  "raw_response_sha256": "fc66c224c0b353d991c10912d05e3a13d4f889f84ccf562bbfaaf975883383d0",
  "raw_response_bytes": 809,
  "truncated": false,
  "migrated_from_v1_sha256": "8fc47d1d396307aac789b8e3d3a5f9230319e5ac2483cc5ae6a8e80303f183fe"
}
